{
  "schema_version": "1.0",
  "symbols": {
    "quickbite/backend/app/main.py::register": {
      "symbol_id": "quickbite/backend/app/main.py::register",
      "filename": "quickbite/backend/app/main.py",
      "language": "python",
      "symbol_type": "function",
      "signature": "register(payload: dict)",
      "start_line": 47,
      "end_line": 62,
      "is_test": false,
      "is_endpoint": true,
      "http_method": "POST",
      "route": "/api/auth/register",
      "raises": [
        "HTTPException"
      ],
      "calls": [
        "quickbite/backend/app/main.py::_hash_password"
      ],
      "called_by": [
        "quickbite/frontend/src/pages/Signup.jsx::Signup"
      ],
      "external_calls": [
        "get",
        "len"
      ],
      "fan_in": 1,
      "fan_out": 1
    },
    "quickbite/backend/app/main.py::_hash_password": {
      "symbol_id": "quickbite/backend/app/main.py::_hash_password",
      "filename": "quickbite/backend/app/main.py",
      "language": "python",
      "symbol_type": "function",
      "signature": "_hash_password(password: str)",
      "start_line": 65,
      "end_line": 68,
      "is_test": false,
      "is_endpoint": false,
      "http_method": null,
      "route": null,
      "raises": [],
      "calls": [],
      "called_by": [
        "quickbite/backend/app/main.py::register"
      ],
      "external_calls": [
        "token_hex",
        "hexdigest",
        "sha256",
        "encode"
      ],
      "fan_in": 1,
      "fan_out": 0
    },
    "quickbite/backend/app/main.py::login": {
      "symbol_id": "quickbite/backend/app/main.py::login",
      "filename": "quickbite/backend/app/main.py",
      "language": "python",
      "symbol_type": "function",
      "signature": "login(payload: dict, request: Request)",
      "start_line": 75,
      "end_line": 98,
      "is_test": false,
      "is_endpoint": true,
      "http_method": "POST",
      "route": "/api/auth/login",
      "raises": [
        "HTTPException"
      ],
      "calls": [],
      "called_by": [],
      "external_calls": [
        "get",
        "next",
        "values",
        "add",
        "token_hex"
      ],
      "fan_in": 0,
      "fan_out": 0
    },
    "quickbite/backend/app/main.py::reset_password": {
      "symbol_id": "quickbite/backend/app/main.py::reset_password",
      "filename": "quickbite/backend/app/main.py",
      "language": "python",
      "symbol_type": "function",
      "signature": "reset_password(payload: dict)",
      "start_line": 108,
      "end_line": 118,
      "is_test": false,
      "is_endpoint": true,
      "http_method": "POST",
      "route": "/api/auth/reset-password",
      "raises": [
        "HTTPException"
      ],
      "calls": [],
      "called_by": [],
      "external_calls": [
        "get",
        "utcnow"
      ],
      "fan_in": 0,
      "fan_out": 0
    },
    "quickbite/backend/app/main.py::create_address": {
      "symbol_id": "quickbite/backend/app/main.py::create_address",
      "filename": "quickbite/backend/app/main.py",
      "language": "python",
      "symbol_type": "function",
      "signature": "create_address(payload: dict)",
      "start_line": 125,
      "end_line": 128,
      "is_test": false,
      "is_endpoint": true,
      "http_method": "POST",
      "route": "/api/addresses",
      "raises": [],
      "calls": [],
      "called_by": [],
      "external_calls": [
        "len"
      ],
      "fan_in": 0,
      "fan_out": 0
    },
    "quickbite/backend/app/main.py::list_addresses": {
      "symbol_id": "quickbite/backend/app/main.py::list_addresses",
      "filename": "quickbite/backend/app/main.py",
      "language": "python",
      "symbol_type": "function",
      "signature": "list_addresses()",
      "start_line": 132,
      "end_line": 133,
      "is_test": false,
      "is_endpoint": true,
      "http_method": "GET",
      "route": "/api/addresses",
      "raises": [],
      "calls": [],
      "called_by": [],
      "external_calls": [
        "list",
        "values"
      ],
      "fan_in": 0,
      "fan_out": 0
    },
    "quickbite/backend/app/main.py::admin_list_users": {
      "symbol_id": "quickbite/backend/app/main.py::admin_list_users",
      "filename": "quickbite/backend/app/main.py",
      "language": "python",
      "symbol_type": "function",
      "signature": "admin_list_users(role: str='customer')",
      "start_line": 140,
      "end_line": 143,
      "is_test": false,
      "is_endpoint": true,
      "http_method": "GET",
      "route": "/api/admin/users",
      "raises": [
        "HTTPException"
      ],
      "calls": [],
      "called_by": [],
      "external_calls": [
        "list",
        "values"
      ],
      "fan_in": 0,
      "fan_out": 0
    },
    "quickbite/backend/app/main.py::list_restaurants": {
      "symbol_id": "quickbite/backend/app/main.py::list_restaurants",
      "filename": "quickbite/backend/app/main.py",
      "language": "python",
      "symbol_type": "function",
      "signature": "list_restaurants(sort_by: str=None)",
      "start_line": 150,
      "end_line": 156,
      "is_test": false,
      "is_endpoint": true,
      "http_method": "GET",
      "route": "/api/restaurants",
      "raises": [],
      "calls": [],
      "called_by": [],
      "external_calls": [
        "values",
        "sort"
      ],
      "fan_in": 0,
      "fan_out": 0
    },
    "quickbite/backend/app/main.py::get_restaurant": {
      "symbol_id": "quickbite/backend/app/main.py::get_restaurant",
      "filename": "quickbite/backend/app/main.py",
      "language": "python",
      "symbol_type": "function",
      "signature": "get_restaurant(restaurant_id: str)",
      "start_line": 160,
      "end_line": 164,
      "is_test": false,
      "is_endpoint": true,
      "http_method": "GET",
      "route": "/api/restaurants/{restaurant_id}",
      "raises": [
        "HTTPException"
      ],
      "calls": [],
      "called_by": [],
      "external_calls": [
        "get"
      ],
      "fan_in": 0,
      "fan_out": 0
    },
    "quickbite/backend/app/main.py::search": {
      "symbol_id": "quickbite/backend/app/main.py::search",
      "filename": "quickbite/backend/app/main.py",
      "language": "python",
      "symbol_type": "function",
      "signature": "search(query: str='')",
      "start_line": 168,
      "end_line": 172,
      "is_test": false,
      "is_endpoint": true,
      "http_method": "GET",
      "route": "/api/search",
      "raises": [
        "HTTPException"
      ],
      "calls": [],
      "called_by": [],
      "external_calls": [
        "values",
        "lower"
      ],
      "fan_in": 0,
      "fan_out": 0
    },
    "quickbite/backend/app/main.py::get_menu_item": {
      "symbol_id": "quickbite/backend/app/main.py::get_menu_item",
      "filename": "quickbite/backend/app/main.py",
      "language": "python",
      "symbol_type": "function",
      "signature": "get_menu_item(item_id: str)",
      "start_line": 179,
      "end_line": 183,
      "is_test": false,
      "is_endpoint": true,
      "http_method": "GET",
      "route": "/api/menu-items/{item_id}",
      "raises": [
        "HTTPException"
      ],
      "calls": [],
      "called_by": [],
      "external_calls": [
        "get"
      ],
      "fan_in": 0,
      "fan_out": 0
    },
    "quickbite/backend/app/main.py::add_to_cart": {
      "symbol_id": "quickbite/backend/app/main.py::add_to_cart",
      "filename": "quickbite/backend/app/main.py",
      "language": "python",
      "symbol_type": "function",
      "signature": "add_to_cart(payload: dict, customer_id: str='demo-customer')",
      "start_line": 190,
      "end_line": 202,
      "is_test": false,
      "is_endpoint": true,
      "http_method": "POST",
      "route": "/api/cart/items",
      "raises": [
        "HTTPException"
      ],
      "calls": [],
      "called_by": [],
      "external_calls": [
        "get",
        "setdefault",
        "append"
      ],
      "fan_in": 0,
      "fan_out": 0
    },
    "quickbite/backend/app/main.py::_cart_subtotal": {
      "symbol_id": "quickbite/backend/app/main.py::_cart_subtotal",
      "filename": "quickbite/backend/app/main.py",
      "language": "python",
      "symbol_type": "function",
      "signature": "_cart_subtotal(customer_id: str)",
      "start_line": 205,
      "end_line": 212,
      "is_test": false,
      "is_endpoint": false,
      "http_method": null,
      "route": null,
      "raises": [],
      "calls": [],
      "called_by": [
        "quickbite/backend/app/main.py::checkout"
      ],
      "external_calls": [
        "get"
      ],
      "fan_in": 1,
      "fan_out": 0
    },
    "quickbite/backend/app/main.py::checkout": {
      "symbol_id": "quickbite/backend/app/main.py::checkout",
      "filename": "quickbite/backend/app/main.py",
      "language": "python",
      "symbol_type": "function",
      "signature": "checkout(payload: dict, customer_id: str='demo-customer')",
      "start_line": 219,
      "end_line": 235,
      "is_test": false,
      "is_endpoint": true,
      "http_method": "POST",
      "route": "/api/checkout",
      "raises": [
        "HTTPException"
      ],
      "calls": [
        "quickbite/backend/app/main.py::_cart_subtotal"
      ],
      "called_by": [
        "quickbite/frontend/src/pages/Checkout.jsx::Checkout"
      ],
      "external_calls": [
        "get"
      ],
      "fan_in": 1,
      "fan_out": 1
    },
    "quickbite/backend/app/main.py::confirm_order": {
      "symbol_id": "quickbite/backend/app/main.py::confirm_order",
      "filename": "quickbite/backend/app/main.py",
      "language": "python",
      "symbol_type": "function",
      "signature": "confirm_order(payload: dict)",
      "start_line": 242,
      "end_line": 246,
      "is_test": false,
      "is_endpoint": true,
      "http_method": "POST",
      "route": "/api/orders/confirm",
      "raises": [],
      "calls": [],
      "called_by": [],
      "external_calls": [
        "len",